{
  "schema": "vdsen-known-failures-v1",
  "source_sha": "904e7bc7822982454fc8cec75f7e5c77d635d02c",
  "captured_at": "2026-10-03T22:01:16.628Z",
  "evidence": {
    "unit_log_sha256": "b8aa1c1c338730feccd47a4a26dd154655956576710ff46d4215b8e50249e733",
    "emulator_log_sha256": "b93403de0f2a043f632e3ae25906203145e4a160b57d4aae2f9e42aae50cf1ec",
    "observation": "Windows Node 24; exact failures reproduced at base and af13a6d; counts are observations, not waivers"
  },
  "failures": [
    {
      "id": "unit:tests/t501-equipment-inventory.test.js::T501.5 docs/EQUIPMENT_INCREMENT_INVENTORY.md is generated and current",
      "category": "unit",
      "suite": "tests/t501-equipment-inventory.test.js",
      "test_name": "T501.5 docs/EQUIPMENT_INCREMENT_INVENTORY.md is generated and current",
      "source_sha": "904e7bc7822982454fc8cec75f7e5c77d635d02c",
      "test_source_sha256": "180ebf79f4ed1bfa71c568a4fdf66300a2df78f2dc99b5836dabf4aed7233f7d",
      "status": "FAIL",
      "reason": "Existing assertion or generated document/template mismatch",
      "captured_at": "2026-10-03T21:57:35.443Z",
      "critical": false
    },
    {
      "id": "unit:tests/t510-equipment-readiness-queue.test.js::T510.5 the activation-readiness report is generated, ranked by usage and current",
      "category": "unit",
      "suite": "tests/t510-equipment-readiness-queue.test.js",
      "test_name": "T510.5 the activation-readiness report is generated, ranked by usage and current",
      "source_sha": "904e7bc7822982454fc8cec75f7e5c77d635d02c",
      "test_source_sha256": "1e0d9db247e4652071b254b2dd77cfde9d3f58062df2f7dd41998be31c752e07",
      "status": "FAIL",
      "reason": "Existing assertion or generated document/template mismatch",
      "captured_at": "2026-10-03T21:57:35.443Z",
      "critical": false
    },
    {
      "id": "unit:tests/t514-shadow-replay.test.js::T514.4 the report document is generated and current; fixtures never touch the shipped catalog",
      "category": "unit",
      "suite": "tests/t514-shadow-replay.test.js",
      "test_name": "T514.4 the report document is generated and current; fixtures never touch the shipped catalog",
      "source_sha": "904e7bc7822982454fc8cec75f7e5c77d635d02c",
      "test_source_sha256": "b47715585baa96bff7bdc9ff385258e10b94b3e0b65dbb3b272295a4578ad0a5",
      "status": "FAIL",
      "reason": "Existing assertion or generated document/template mismatch",
      "captured_at": "2026-10-03T21:57:35.443Z",
      "critical": false
    },
    {
      "id": "unit:tests/t516-pre-activation-audit.test.js::T516.9 the activation guard has 19 checks and the pre-activation documents are current",
      "category": "unit",
      "suite": "tests/t516-pre-activation-audit.test.js",
      "test_name": "T516.9 the activation guard has 19 checks and the pre-activation documents are current",
      "source_sha": "904e7bc7822982454fc8cec75f7e5c77d635d02c",
      "test_source_sha256": "aa1a381abb49d54c9ea49d037986b17a603124b638bd006379b90330f42c58e5",
      "status": "FAIL",
      "reason": "Existing assertion or generated document/template mismatch",
      "captured_at": "2026-10-03T21:57:35.443Z",
      "critical": false
    },
    {
      "id": "unit:tests/t521-science-sources.test.js::T521.6 analysis only: nothing in the app or canonical modules references the simulator; the report is current",
      "category": "unit",
      "suite": "tests/t521-science-sources.test.js",
      "test_name": "T521.6 analysis only: nothing in the app or canonical modules references the simulator; the report is current",
      "source_sha": "904e7bc7822982454fc8cec75f7e5c77d635d02c",
      "test_source_sha256": "c1adcba999418f46d6fc69268ef40df9b70965591a3a733830fc5b179ebcd1c5",
      "status": "FAIL",
      "reason": "Existing assertion or generated document/template mismatch",
      "captured_at": "2026-10-03T21:57:35.443Z",
      "critical": false
    },
    {
      "id": "unit:tests/t522-activation-docs.test.js::T522.1 both documents are generated and current",
      "category": "unit",
      "suite": "tests/t522-activation-docs.test.js",
      "test_name": "T522.1 both documents are generated and current",
      "source_sha": "904e7bc7822982454fc8cec75f7e5c77d635d02c",
      "test_source_sha256": "ae1b8b1e62a7c64623653b7a6db3f41500801f68aa42599e86f5ff586926c89d",
      "status": "FAIL",
      "reason": "Existing assertion or generated document/template mismatch",
      "captured_at": "2026-10-03T21:57:35.443Z",
      "critical": false
    },
    {
      "id": "unit:tests/t525-equipment-data-required.test.js::T525.1 generated files are current",
      "category": "unit",
      "suite": "tests/t525-equipment-data-required.test.js",
      "test_name": "T525.1 generated files are current",
      "source_sha": "904e7bc7822982454fc8cec75f7e5c77d635d02c",
      "test_source_sha256": "15aa31b4d026c19c63d580ef1489bdf816648194640ba866d6c59bea3cad6306",
      "status": "FAIL",
      "reason": "Existing assertion or generated document/template mismatch",
      "captured_at": "2026-10-03T21:57:35.443Z",
      "critical": false
    },
    {
      "id": "unit:tests/t525-equipment-data-required.test.js::T525.3 template has BLANK value cells only (no invented numbers)",
      "category": "unit",
      "suite": "tests/t525-equipment-data-required.test.js",
      "test_name": "T525.3 template has BLANK value cells only (no invented numbers)",
      "source_sha": "904e7bc7822982454fc8cec75f7e5c77d635d02c",
      "test_source_sha256": "15aa31b4d026c19c63d580ef1489bdf816648194640ba866d6c59bea3cad6306",
      "status": "FAIL",
      "reason": "Existing assertion or generated document/template mismatch",
      "captured_at": "2026-10-03T21:57:35.443Z",
      "critical": false
    },
    {
      "id": "unit:tests/t527-lifecycle-final-audit.test.js::T527.5 lifecycle audit doc lists every missing transition; generated docs are current",
      "category": "unit",
      "suite": "tests/t527-lifecycle-final-audit.test.js",
      "test_name": "T527.5 lifecycle audit doc lists every missing transition; generated docs are current",
      "source_sha": "904e7bc7822982454fc8cec75f7e5c77d635d02c",
      "test_source_sha256": "bddef661064859c1db77d42b5b8db066f6df37874a95238c0bcf7e5b08d4ab46",
      "status": "FAIL",
      "reason": "Existing assertion or generated document/template mismatch",
      "captured_at": "2026-10-03T21:57:35.443Z",
      "critical": false
    },
    {
      "id": "unit:tests/t535-final-lifecycle-audit.test.js::T535.4 the blank bulk template imports (all-or-nothing) into a config the lifecycle accepts; only the configured equipment becomes eligible",
      "category": "unit",
      "suite": "tests/t535-final-lifecycle-audit.test.js",
      "test_name": "T535.4 the blank bulk template imports (all-or-nothing) into a config the lifecycle accepts; only the configured equipment becomes eligible",
      "source_sha": "904e7bc7822982454fc8cec75f7e5c77d635d02c",
      "test_source_sha256": "f2d237df689a3ae568df4323cf76ebed03ae6785692663f70b76ae48933f0ed1",
      "status": "FAIL",
      "reason": "Existing assertion or generated document/template mismatch",
      "captured_at": "2026-10-03T21:57:35.443Z",
      "critical": false
    },
    {
      "id": "unit:tests/t535-final-lifecycle-audit.test.js::T535.6 the generated readiness documents state the lifecycle readiness derived from live facts, and the flag/data blockers",
      "category": "unit",
      "suite": "tests/t535-final-lifecycle-audit.test.js",
      "test_name": "T535.6 the generated readiness documents state the lifecycle readiness derived from live facts, and the flag/data blockers",
      "source_sha": "904e7bc7822982454fc8cec75f7e5c77d635d02c",
      "test_source_sha256": "f2d237df689a3ae568df4323cf76ebed03ae6785692663f70b76ae48933f0ed1",
      "status": "FAIL",
      "reason": "Existing assertion or generated document/template mismatch",
      "captured_at": "2026-10-03T21:57:35.443Z",
      "critical": false
    },
    {
      "id": "unit:tests/t535-final-lifecycle-audit.test.js::T535.7 the minimal data request names exactly the fields for Mancuernas and Barra olímpica and prefills nothing",
      "category": "unit",
      "suite": "tests/t535-final-lifecycle-audit.test.js",
      "test_name": "T535.7 the minimal data request names exactly the fields for Mancuernas and Barra olímpica and prefills nothing",
      "source_sha": "904e7bc7822982454fc8cec75f7e5c77d635d02c",
      "test_source_sha256": "f2d237df689a3ae568df4323cf76ebed03ae6785692663f70b76ae48933f0ed1",
      "status": "FAIL",
      "reason": "Existing assertion or generated document/template mismatch",
      "captured_at": "2026-10-03T21:57:35.443Z",
      "critical": false
    },
    {
      "id": "unit:tests/t537-write-boundary.test.js::T537.3 the athlete app has NO canonical writer: no record creation, no queue, no overlay/summary payload; only the receipt path writes into the lifecycle area",
      "category": "unit",
      "suite": "tests/t537-write-boundary.test.js",
      "test_name": "T537.3 the athlete app has NO canonical writer: no record creation, no queue, no overlay/summary payload; only the receipt path writes into the lifecycle area",
      "source_sha": "904e7bc7822982454fc8cec75f7e5c77d635d02c",
      "test_source_sha256": "ec59cda9004dcfd0ce1b8f39affb794540ce5163db6d6c5f91dd8987cacb21ce",
      "status": "FAIL",
      "reason": "TypeError reading missing regex match",
      "captured_at": "2026-10-03T21:57:35.443Z",
      "critical": true
    },
    {
      "id": "emulator:tests/t538-tenant-isolation.cjs::T01 an unrelated or self-created Coach cannot read another Coach client profile (get, list, filtered list)",
      "category": "emulator",
      "suite": "tests/t538-tenant-isolation.cjs",
      "test_name": "T01 an unrelated or self-created Coach cannot read another Coach client profile (get, list, filtered list)",